{
  "schema_version": "1.0.6",
  "advisor_id": "deng-meichun",
  "source_scope": "Official CSU advisor profile/representative list plus DOI, PubMed and Europe PMC discovery metadata; local Owner review only.",
  "candidate_evidence": [
    {
      "evidence_id": "E1",
      "evidence_type": "official_profile",
      "source_url": "https://life.csu.edu.cn/info/1042/2539.htm",
      "source_authority": "official_institution",
      "candidate_statuses": [
        "adopted"
      ],
      "reason": "学院官方导师主页，作为身份、职务、联系方式与研究方向的一手来源。",
      "supported_fields": [
        "name_zh",
        "institution",
        "school_or_department",
        "position",
        "public_roles",
        "contact",
        "research_directions_original",
        "research_directions_plain_language",
        "research_questions",
        "main_techniques",
        "research_workflow",
        "possible_undergraduate_tasks",
        "prerequisite_skills",
        "learning_cost",
        "generic_growth_path",
        "summary"
      ],
      "repository_source_ref": "evidence-manifest-v1.json#E1",
      "last_verified_at": "2026-09-09",
      "notes": "只保留官方页面公开信息；不推断招生、培养承诺或实验室氛围。",
      "page_title": "邓梅春",
      "profile_name": "邓梅春",
      "institution": "中南大学",
      "school_or_department": "生命科学学院生物化学与分子生物学系",
      "extracted_facts": [
        {
          "fact_id": "F1",
          "fact_text": "职称为教授。",
          "fact_category": "professional_title",
          "source_section": "学院官方导师主页",
          "source_anchor": "公开字段：position",
          "supported_public_fields": [
            "position"
          ]
        },
        {
          "fact_id": "F2",
          "fact_text": "公开角色为博士生导师。",
          "fact_category": "supervisor_type",
          "source_section": "学院官方导师主页",
          "source_anchor": "公开字段：public_roles",
          "supported_public_fields": [
            "public_roles"
          ]
        },
        {
          "fact_id": "F3",
          "fact_text": "疼痛、肿瘤和皮肤损伤的发生机制，以及药物先导分子的药理学作用。",
          "fact_category": "research_direction",
          "source_section": "主要研究方向",
          "source_anchor": "公开字段：research_directions_original",
          "supported_public_fields": [
            "research_directions_original",
            "research_questions"
          ]
        },
        {
          "fact_id": "F4",
          "fact_text": "主页公开方法或方向涉及分子与细胞机制研究及药理学评价。",
          "fact_category": "research_method",
          "source_section": "主要研究方向",
          "source_anchor": "公开字段：main_techniques",
          "supported_public_fields": [
            "main_techniques",
            "research_workflow"
          ]
        }
      ]
    },
    {
      "evidence_id": "E2",
      "evidence_type": "publication",
      "source_url": "https://doi.org/10.1016/j.ijbiomac.2024.136767",
      "source_authority": "publication",
      "candidate_statuses": [
        "adopted"
      ],
      "reason": "Official representative list plus PubMed DOI, author and current affiliation.",
      "supported_fields": [
        "name_en",
        "research_directions_plain_language",
        "research_questions",
        "main_techniques",
        "research_workflow",
        "possible_undergraduate_tasks",
        "prerequisite_skills",
        "learning_cost",
        "generic_growth_path",
        "summary"
      ],
      "repository_source_ref": "evidence-manifest-v1.json#E2",
      "last_verified_at": "2026-09-10",
      "notes": "PubMed PMID 39476923; Official representative list plus PubMed DOI, author and current affiliation. Candidate/adoption is not a featured or release decision. Owner decision 2026-09-10: adopted for local publication review; not release approval.",
      "title": "SETD2 deficiency in peripheral sensory neurons induces allodynia by promoting NMDA receptor expression through NFAT5 in rodent models.",
      "publication_year": 2024,
      "doi": "10.1016/j.ijbiomac.2024.136767",
      "source_type": "journal_article",
      "author_position": "last",
      "is_co_first": null,
      "is_corresponding": null,
      "identity_verified": true,
      "version_group": null,
      "publication_types": [
        "journal_article"
      ],
      "publication_affiliations": [
        "Central South University"
      ],
      "publication_affiliation_source_url": "https://doi.org/10.1016/j.ijbiomac.2024.136767"
    },
    {
      "evidence_id": "E3",
      "evidence_type": "publication",
      "source_url": "https://doi.org/10.1016/j.isci.2024.111110",
      "source_authority": "publication",
      "candidate_statuses": [
        "adopted"
      ],
      "reason": "Official representative list plus PubMed DOI, author and current affiliation.",
      "supported_fields": [
        "name_en",
        "research_directions_plain_language",
        "research_questions",
        "main_techniques",
        "research_workflow",
        "possible_undergraduate_tasks",
        "prerequisite_skills",
        "learning_cost",
        "generic_growth_path",
        "summary"
      ],
      "repository_source_ref": "evidence-manifest-v1.json#E3",
      "last_verified_at": "2026-09-10",
      "notes": "PubMed PMID 39507260; Official representative list plus PubMed DOI, author and current affiliation. Candidate/adoption is not a featured or release decision. Owner decision 2026-09-10: adopted for local publication review; not release approval.",
      "title": "Overactive PKA signaling underlies the hyperalgesia in an ADHD mouse model.",
      "publication_year": 2024,
      "doi": "10.1016/j.isci.2024.111110",
      "source_type": "journal_article",
      "author_position": "middle",
      "is_co_first": null,
      "is_corresponding": null,
      "identity_verified": true,
      "version_group": null,
      "publication_types": [
        "journal_article"
      ],
      "publication_affiliations": [
        "Central South University"
      ],
      "publication_affiliation_source_url": "https://doi.org/10.1016/j.isci.2024.111110"
    },
    {
      "evidence_id": "E4",
      "evidence_type": "publication",
      "source_url": "https://doi.org/10.3389/fphar.2023.1067665",
      "source_authority": "publication",
      "candidate_statuses": [
        "adopted"
      ],
      "reason": "Official representative list plus PubMed DOI, author and current affiliation.",
      "supported_fields": [
        "name_en",
        "research_directions_plain_language",
        "research_questions",
        "main_techniques",
        "research_workflow",
        "possible_undergraduate_tasks",
        "prerequisite_skills",
        "learning_cost",
        "generic_growth_path",
        "summary"
      ],
      "repository_source_ref": "evidence-manifest-v1.json#E4",
      "last_verified_at": "2026-09-10",
      "notes": "PubMed PMID 37033662; Official representative list plus PubMed DOI, author and current affiliation. Candidate/adoption is not a featured or release decision. Owner decision 2026-09-10: adopted for local publication review; not release approval.",
      "title": "Spider venom-derived peptide JZTX-14 prevents migration and invasion of breast cancer cells via inhibition of sodium channels.",
      "publication_year": 2023,
      "doi": "10.3389/fphar.2023.1067665",
      "source_type": "journal_article",
      "author_position": "last",
      "is_co_first": null,
      "is_corresponding": null,
      "identity_verified": true,
      "version_group": null,
      "publication_types": [
        "journal_article"
      ],
      "publication_affiliations": [
        "Central South University"
      ],
      "publication_affiliation_source_url": "https://doi.org/10.3389/fphar.2023.1067665"
    },
    {
      "evidence_id": "E5",
      "evidence_type": "publication",
      "source_url": "https://doi.org/10.1093/eurjpc/zwab099",
      "source_authority": "publication",
      "candidate_statuses": [
        "adopted"
      ],
      "reason": "Official representative list plus PubMed DOI, author and current affiliation.",
      "supported_fields": [
        "name_en",
        "research_directions_plain_language",
        "research_questions",
        "main_techniques",
        "research_workflow",
        "possible_undergraduate_tasks",
        "prerequisite_skills",
        "learning_cost",
        "generic_growth_path",
        "summary"
      ],
      "repository_source_ref": "evidence-manifest-v1.json#E5",
      "last_verified_at": "2026-09-10",
      "notes": "PubMed PMID 34136913; Official representative list plus PubMed DOI, author and current affiliation. Candidate/adoption is not a featured or release decision. Owner decision 2026-09-10: adopted for local publication review; not release approval.",
      "title": "Comparison of cardiovascular outcomes and cardiometabolic risk factors between patients with type 2 diabetes treated with sodium-glucose cotransporter-2 inhibitors and dipeptidyl peptidase-4 inhibitors: a meta-analysis.",
      "publication_year": 2022,
      "doi": "10.1093/eurjpc/zwab099",
      "source_type": "meta_analysis",
      "author_position": "last",
      "is_co_first": null,
      "is_corresponding": null,
      "identity_verified": true,
      "version_group": null,
      "publication_types": [
        "meta_analysis"
      ],
      "publication_affiliations": [
        "Central South University"
      ],
      "publication_affiliation_source_url": "https://doi.org/10.1093/eurjpc/zwab099"
    },
    {
      "evidence_id": "E6",
      "evidence_type": "publication",
      "source_url": "https://doi.org/10.1097/aln.0000000000002648",
      "source_authority": "publication",
      "candidate_statuses": [
        "adopted"
      ],
      "reason": "Official representative list plus PubMed DOI and publication-time MD Anderson/CSU career affiliation.",
      "supported_fields": [
        "name_en",
        "research_directions_plain_language",
        "research_questions",
        "main_techniques",